{
  "schema_version": "predsea.marine_region.v1",
  "region_id": "algerian_1km",
  "label": "Algerian Basin 1km regional forecast",
  "bbox": {
    "longitude_min": -1.0,
    "longitude_max": 8.5,
    "latitude_min": 35.0,
    "latitude_max": 38.0
  },
  "horizontal_resolution_m": 1000,
  "output_interval_hours": 1,
  "models": {
    "swan": {
      "directions": 36,
      "frequencies": 32,
      "computational_timestep_minutes": 5,
      "required_variables": [
        "significant_wave_height"
      ],
      "physical_ranges": {
        "significant_wave_height": [0.0, 20.0],
        "peak_wave_period": [0.0, 40.0],
        "mean_wave_direction": [0.0, 360.0]
      }
    },
    "croco": {
      "vertical_levels": 32,
      "compiled_grid_shape": {
        "xi_rho": 951,
        "eta_rho": 301
      },
      "timestep_seconds": 5,
      "ndtfast": 40,
      "grid_gcs_uri": "gs://predsea-daily-outputs-test/static/native-marine/algerian_1km/croco-grid/20260727-v1/croco_grid.nc",
      "required_variables": [
        "eastward_current",
        "northward_current",
        "sea_surface_temperature",
        "sea_surface_salinity",
        "sea_surface_height"
      ],
      "physical_ranges": {
        "eastward_current": [-5.0, 5.0],
        "northward_current": [-5.0, 5.0],
        "sea_surface_temperature": [-2.5, 40.0],
        "sea_surface_salinity": [0.0, 45.0],
        "sea_surface_height": [-5.0, 5.0]
      }
    }
  },
  "forcing": {
    "atmosphere": "predsea_wrf",
    "ocean_initial_and_boundary": "cmems",
    "wave_open_boundary": "cmems"
  }
}
